{
 "schema": "action-receipt.v1",
 "action_id": "act:39e88d42a2ef037969df",
 "idempotency_key": "act:39e88d42a2ef037969df:d31e6b94fb90d1a0c9326f2a97b16657",
 "status": "EXECUTED",
 "classification": "A0",
 "started_at": "2026-08-19T00:01:30",
 "finished_at": "2026-08-19T00:01:30",
 "steps_completed": [
  {
   "op": "observe",
   "result": "read"
  }
 ],
 "artifacts": [],
 "external_effects": [],
 "cost": 0.0,
 "before": {},
 "after": {},
 "rollback_available": false,
 "evidence": [
  {
   "path": "state/telegram/tool-requests.jsonl",
   "exists": true,
   "bytes": 167345
  }
 ],
 "errors": []
}